{"evaluated_at":"2026-09-05T16:12:00Z","limitations":["ordered_strength_two_operation_coverage_does_not_establish_longer_sequence_coverage","each_measured_operation_uses_an_isolated_requester_scope_to_keep_state_preconditions_stable","reference_submission_tests_the_reference_semantics_not_an_external_gateway","passing_does_not_establish_cross_subject_interference_unrepresented_operations_or_complete_mediation","passing_is_not_compliance_certification_safety_legal_authority_or_deployment_authorization"],"method":{"name":"cyclic-de-bruijn-ordered-operation-coverage","operation_alphabet":["fresh-allow","replay-block","budget-boundary-allow","budget-exceed-block","expired-window-allow"],"strength":2},"operation_results":[{"case_id":"case-0021","expected_decision":"allow","expected_reason_code":"authority_satisfied","operation":"fresh-allow","status":"pass","submitted_decision":"allow","submitted_reason_code":"authority_satisfied"},{"case_id":"case-0022","expected_decision":"allow","expected_reason_code":"authority_satisfied","operation":"fresh-allow","status":"pass","submitted_decision":"allow","submitted_reason_code":"authority_satisfied"},{"case_id":"case-0023","expected_decision":"block","expected_reason_code":"approval_replay","operation":"replay-block","status":"pass","submitted_decision":"block","submitted_reason_code":"approval_replay"},{"case_id":"case-0024","expected_decision":"allow","expected_reason_code":"authority_satisfied","operation":"fresh-allow","status":"pass","submitted_decision":"allow","submitted_reason_code":"authority_satisfied"},{"case_id":"case-0025","expected_decision":"allow","expected_reason_code":"authority_satisfied","operation":"budget-boundary-allow","status":"pass","submitted_decision":"allow","submitted_reason_code":"authority_satisfied"},{"case_id":"case-0026","expected_decision":"allow","expected_reason_code":"authority_satisfied","operation":"fresh-allow","status":"pass","submitted_decision":"allow","submitted_reason_code":"authority_satisfied"},{"case_id":"case-0027","expected_decision":"block","expected_reason_code":"cumulative_limit_exceeded","operation":"budget-exceed-block","status":"pass","submitted_decision":"block","submitted_reason_code":"cumulative_limit_exceeded"},{"case_id":"case-0028","expected_decision":"allow","expected_reason_code":"authority_satisfied","operation":"fresh-allow","status":"pass","submitted_decision":"allow","submitted_reason_code":"authority_satisfied"},{"case_id":"case-0029","expected_decision":"allow","expected_reason_code":"authority_satisfied","operation":"expired-window-allow","status":"pass","submitted_decision":"allow","submitted_reason_code":"authority_satisfied"},{"case_id":"case-0030","expected_decision":"block","expected_reason_code":"approval_replay","operation":"replay-block","status":"pass","submitted_decision":"block","submitted_reason_code":"approval_replay"},{"case_id":"case-0031","expected_decision":"block","expected_reason_code":"approval_replay","operation":"replay-block","status":"pass","submitted_decision":"block","submitted_reason_code":"approval_replay"},{"case_id":"case-0032","expected_decision":"allow","expected_reason_code":"authority_satisfied","operation":"budget-boundary-allow","status":"pass","submitted_decision":"allow","submitted_reason_code":"authority_satisfied"},{"case_id":"case-0033","expected_decision":"block","expected_reason_code":"approval_replay","operation":"replay-block","status":"pass","submitted_decision":"block","submitted_reason_code":"approval_replay"},{"case_id":"case-0034","expected_decision":"block","expected_reason_code":"cumulative_limit_exceeded","operation":"budget-exceed-block","status":"pass","submitted_decision":"block","submitted_reason_code":"cumulative_limit_exceeded"},{"case_id":"case-0035","expected_decision":"block","expected_reason_code":"approval_replay","operation":"replay-block","status":"pass","submitted_decision":"block","submitted_reason_code":"approval_replay"},{"case_id":"case-0036","expected_decision":"allow","expected_reason_code":"authority_satisfied","operation":"expired-window-allow","status":"pass","submitted_decision":"allow","submitted_reason_code":"authority_satisfied"},{"case_id":"case-0037","expected_decision":"allow","expected_reason_code":"authority_satisfied","operation":"budget-boundary-allow","status":"pass","submitted_decision":"allow","submitted_reason_code":"authority_satisfied"},{"case_id":"case-0038","expected_decision":"allow","expected_reason_code":"authority_satisfied","operation":"budget-boundary-allow","status":"pass","submitted_decision":"allow","submitted_reason_code":"authority_satisfied"},{"case_id":"case-0039","expected_decision":"block","expected_reason_code":"cumulative_limit_exceeded","operation":"budget-exceed-block","status":"pass","submitted_decision":"block","submitted_reason_code":"cumulative_limit_exceeded"},{"case_id":"case-0040","expected_decision":"allow","expected_reason_code":"authority_satisfied","operation":"budget-boundary-allow","status":"pass","submitted_decision":"allow","submitted_reason_code":"authority_satisfied"},{"case_id":"case-0041","expected_decision":"allow","expected_reason_code":"authority_satisfied","operation":"expired-window-allow","status":"pass","submitted_decision":"allow","submitted_reason_code":"authority_satisfied"},{"case_id":"case-0042","expected_decision":"block","expected_reason_code":"cumulative_limit_exceeded","operation":"budget-exceed-block","status":"pass","submitted_decision":"block","submitted_reason_code":"cumulative_limit_exceeded"},{"case_id":"case-0043","expected_decision":"block","expected_reason_code":"cumulative_limit_exceeded","operation":"budget-exceed-block","status":"pass","submitted_decision":"block","submitted_reason_code":"cumulative_limit_exceeded"},{"case_id":"case-0044","expected_decision":"allow","expected_reason_code":"authority_satisfied","operation":"expired-window-allow","status":"pass","submitted_decision":"allow","submitted_reason_code":"authority_satisfied"},{"case_id":"case-0045","expected_decision":"allow","expected_reason_code":"authority_satisfied","operation":"expired-window-allow","status":"pass","submitted_decision":"allow","submitted_reason_code":"authority_satisfied"},{"case_id":"case-0046","expected_decision":"allow","expected_reason_code":"authority_satisfied","operation":"fresh-allow","status":"pass","submitted_decision":"allow","submitted_reason_code":"authority_satisfied"}],"ordered_pair_coverage":{"covered_pairs":["budget-boundary-allow>budget-boundary-allow","budget-boundary-allow>budget-exceed-block","budget-boundary-allow>expired-window-allow","budget-boundary-allow>fresh-allow","budget-boundary-allow>replay-block","budget-exceed-block>budget-boundary-allow","budget-exceed-block>budget-exceed-block","budget-exceed-block>expired-window-allow","budget-exceed-block>fresh-allow","budget-exceed-block>replay-block","expired-window-allow>budget-boundary-allow","expired-window-allow>budget-exceed-block","expired-window-allow>expired-window-allow","expired-window-allow>fresh-allow","expired-window-allow>replay-block","fresh-allow>budget-boundary-allow","fresh-allow>budget-exceed-block","fresh-allow>expired-window-allow","fresh-allow>fresh-allow","fresh-allow>replay-block","replay-block>budget-boundary-allow","replay-block>budget-exceed-block","replay-block>expired-window-allow","replay-block>fresh-allow","replay-block>replay-block"],"missing_pairs":[],"required_pairs":["budget-boundary-allow>budget-boundary-allow","budget-boundary-allow>budget-exceed-block","budget-boundary-allow>expired-window-allow","budget-boundary-allow>fresh-allow","budget-boundary-allow>replay-block","budget-exceed-block>budget-boundary-allow","budget-exceed-block>budget-exceed-block","budget-exceed-block>expired-window-allow","budget-exceed-block>fresh-allow","budget-exceed-block>replay-block","expired-window-allow>budget-boundary-allow","expired-window-allow>budget-exceed-block","expired-window-allow>expired-window-allow","expired-window-allow>fresh-allow","expired-window-allow>replay-block","fresh-allow>budget-boundary-allow","fresh-allow>budget-exceed-block","fresh-allow>expired-window-allow","fresh-allow>fresh-allow","fresh-allow>replay-block","replay-block>budget-boundary-allow","replay-block>budget-exceed-block","replay-block>expired-window-allow","replay-block>fresh-allow","replay-block>replay-block"]},"report_id":"luremandate-sequence-reference-submission-1-score-sequence","schema":"https://github.com/immu4989/lurebench/spec/luremandate-sequence-assurance/v1","schema_version":1,"score":{"challenge":{"campaign_id":"luremandate-sequence-v1","cases":[{"case_id":"case-0001","sequence":1,"transaction":{"approvals":[{"approval_id":"sequence-09-prime-mission","approver_id":"approver-mission","approver_role":"mission-owner","decision":"approve","expires_at":"2026-09-05T15:00:01.900Z","intent_sha256":"6c30bc24bb790aa986e8fba77bb9481f914c3cfbe1fe4c5c89f140ee3851eb8b","issued_at":"2026-09-05T15:00:01.200Z","nonce":"sequence-09-prime-mission-nonce"},{"approval_id":"sequence-09-prime-security","approver_id":"approver-security","approver_role":"security-reviewer","decision":"approve","expires_at":"2026-09-05T15:00:01.900Z","intent_sha256":"6c30bc24bb790aa986e8fba77bb9481f914c3cfbe1fe4c5c89f140ee3851eb8b","issued_at":"2026-09-05T15:00:01.200Z","nonce":"sequence-09-prime-security-nonce"}],"decided_at":"2026-09-05T15:00:01.400Z","intent":{"action":"state-prime","agent_id":"agent-a","impact_units":100,"intent_id":"sequence-09-prime-intent","intent_nonce":"sequence-09-prime-intent-nonce","policy_id":"high-impact","proposed_at":"2026-09-05T15:00:01.100Z","requester_id":"sequence-subject-09","resource_id":"sequence-resource-09","run_id":"mandate-sequence-run-1","tenant_id":"agency-tenant","workload_spiffe_id":"spiffe://example.gov/workload/agent-a"},"intent_sha256":"6c30bc24bb790aa986e8fba77bb9481f914c3cfbe1fe4c5c89f140ee3851eb8b","transaction_id":"preamble-01"}},{"case_id":"case-0002","sequence":